ID,Post,Comment,Label
180,"""I have training in physics and maths and have been looking at statistical programming jobs in the private sector (mostly biotech), and it seems like every single company wants to use SAS. I gave it a shot over the weekend, as I usually just use Python or R, and holy shit this language is such garbage. Why do companies willingly use this? It's extortionate, syntactically awful, closed-source, has terrible docs, and lags a LOT of functionality behind modern statistical packages implemented in Python and R.

A lot of the statistical programming work sounds interesting except that it's in SAS, and I just cannot fathom why anybody would keep using this garbage instead of R + Tableau or something. Am I missing something? Is this something I'll just have to get over and learn?""","""Two good reasons and two extremely shitty reasons. One good reason is that because the source code is extremely stable from one edition to the next, legacy code remains supported by production versions of SAS basically indefinitely.

The second good reason is that it's got pretty solid memory management when your data requires more ram than your machine has. It won't just crash, it'll make intelligent use of vram without any user effort or input. You can work around this in R or Python but you have to be deliberate afaik.

The shitty reasons are 1) that managers are dinosaurs who don't know how to code and aren't willing to learn, and because of that they don't know what they're missing, and too many of the people who know better care too much about being polite and diplomatic to confront them on just how assanine this is. 2) Other dinosaurs who know even less than those managers believe in the persist myth that paying for software provides some kind of liability protection compared to open source, despite being wildly unable to articulate what sort of liabilty they're concerned about.""",direct
181,"""Hey everyone,

I just started my first ever job as a junior dev last week (fresh out of school), and honestly it already feels like a disaster. I’m starting to question myself a bit.

My first day was Monday, and by Friday I was already in home office. Same today too and Monday too. The only office days are Wednesday and Thursday, which feels a bit sad because I’m brand new and immediately working from home with barely any guidance is to much.

I never really got a proper introduction to the project, the systems, or how tickets are normally solved. My very first ticket was basically: “Yo, look in our system, I have a ticket for you, try to solve it. If you have questions, ask me…” That’s it. No walkthrough, no explanation of where to start. I asked how they usually approach tickets or where to even find the relevant code, but I still felt pretty lost.

To be fair, I did get a decent intro into the running software itself, so I kind of understand the product. But that’s where it ended. Meanwhile, I see other people who started just a month before me sitting next to their team lead getting tons of explanations and support.

Somehow I managed to solve 3 tickets (a mix of with and without help), but most of the time I have nothing to do. I’m just sitting here, bored, not knowing what I should be learning or focusing on.

I’ve tried to be proactive and ask what I could look into:

Yesterday I asked if there were patterns or frameworks I should study. The response was just: “Take a look at EF and how we make the models"" EF and setting up a config for models isnt that hard so I understood it quite fast.

Today I asked again and just got sent some tickets to read through “to see if I understand what the customer wants.” which is so overwhelming.

Another coworker told me to check out their validation logic cause I will be working with this part of the project, but there are a ton of files with different rules and it’s overwhelming to dig into alone at home.

So now I’m just sitting here wondering: am I doing something wrong? Is it normal to feel this lost and useless in the first week? Or did I pick the wrong career path entirely?

It’s super frustrating because I want to learn and contribute, but right now it feels like I’m just drifting.

Has anyone else been in this situation? Is this just how the start usually feels, or is this a red flag?""","""I have over 20 years of experience as a programmer. Your description of how it is to be dumped into a new project pretty much sums it up for me.""",direct
182,"""Why is harry potter so good?""","""The characters,the story,the setting.""",direct
183,"""can i learn to cook without actually cooking? hello, i really want to learn to cook since its a really important skill to have, but my mom doesnt let me inside the kitchen and says she will cook for me,, she wants me to depend on her and says after that my future wife will do the cooking for me,,which sounds yucky, can i learn to cook by just watching vidoes?""","""Videos are great. You can also follow written recipes, just look up terms and abbreviations if you don't understand it.""",direct
184,"""Just been thinking about this lately... been coding for like 3 yrs now and realized some tiny habits I picked up have made my code wayyy better.

For me it was finally learning how to use git properly lol (not just git add . commit ""stuff"" push 😅) and actually writing tests before fixing bugs instead of after.

What little thing do you do thats had a huge impact? Doesn't have to be anything fancy, just those ""oh crap why didnt i do this earlier"" moments.""","""I'm a high school CS teacher. I see many of you mentioning unit testing and TDD. Do you have any good resources for how to ease high school students into that? Emphasis on EASE them into it, because far too often things I find online ramp up in difficulty either right from the start or way too fast.""",related
185,"""What's your honest opinion on Tinder?""","""I find it boring. I tried once and I didn’t like it really. Uninstalled it immediately.""",direct
186,"""Is there a politician you strongly disagree with politically but still respect? Why?""","""Rishi Sunak

He did a lot of things to benefit the wealthy, but at least he stood up for his beliefs even when people were easily offended""",direct
187,"""How do you feel about Trump threatening to impose photo ID for voters for midterm elections?""","""I feel like states control elections""",direct
188,"""Parmesan rind substitute? I keep being intrigued with recipes that turn out to call for a parmesan rind. Which I've never had and can't honestly say I expect to have, really - I just don't use parmesan much. I'm assuming that for the usual (soup or stew) recipes that call for this, probably throwing in an equivalent weight of actual cheese is not the answer 😂 So... what's my best bet? MSG? Fish sauce? Something else? Just shrug and omit it? Pass on the recipe altogether?""","""They don’t add much flavor, just some background umami. Oddly they won’t even melt, just sort of get very gooey. As stated, fish sauce or equal is better.""",direct
189,"""Derivatives were conceptualized originally as the slope of the tangent line of a function at a point. I’ve done 1.5 years of analysis, so I am extremely familiar with the rigorous definition and such. I’m in my first semester of algebra, and our homework included a question derivatives and polynomial long division. That made me wonder, is there a purely algebraic approach rigorous approach to calculus? That may be hard to define. Is there any way to abstract a derivative of a function? Let me know your thoughts or if you’ve thought about the same!""","""Yes. One quite abstract approach is called Fermat theories.

It's easiest to begin from Hadamard's lemma, which in one variable says that for any smooth function f(x), there exists a unique function g(x) such that f(x) = f(0) + xg(x). Such a function g is called the Hadamard quotient of f.

Note that f'(0) = g(0)--so we can recover the derivative from knowledge of g. Indeed, huge chunks of differential calculus, including Taylor's theorem, chain rule etc. can be recovered from the Hadamard quotient.

Because of this you can go the other way, and consider theories of generalized polynomial algebras (loosely speaking) such that every element has a unique Hadamard quotient. Such a theory is called a Fermat theory. In any Fermat theory you can develop an abstract differential calculus just from the existence of unique Hadamard quotients.""",direct
190,"""Best sports piracy website? Since Sportsnet + has gone up to $400 CAD what are good streaming sites?""","""Sportsurge""",direct
191,"""Is league still worth getting into for a new player?""","""I loved learning the game. Turn chat off and focus on improving. It’s got a big learning curve but I loved being surprised what kind of crazy stuff unfamiliar champs could do""",direct
192,"""I have training in physics and maths and have been looking at statistical programming jobs in the private sector (mostly biotech), and it seems like every single company wants to use SAS. I gave it a shot over the weekend, as I usually just use Python or R, and holy shit this language is such garbage. Why do companies willingly use this? It's extortionate, syntactically awful, closed-source, has terrible docs, and lags a LOT of functionality behind modern statistical packages implemented in Python and R.

A lot of the statistical programming work sounds interesting except that it's in SAS, and I just cannot fathom why anybody would keep using this garbage instead of R + Tableau or something. Am I missing something? Is this something I'll just have to get over and learn?""","""Plenty of biotech jobs use R and Python too. You need to look for bioinformatics, DS analytics, ML, etc positions and not biostatistician or stat programmer titled positions. Indeed SAS is hot garbage but you need to target your search better.""",related
193,"""What are your thoughts about the resurgence of the Black Panther Party in response to the actions of ICE agents?""","""The Black Panthers used 2A the way it was intended to be used. A government should be afraid of their people. Current admin needs to be re-taught that fear.""",direct
194,"""Is basketball not a popular sport in China? r/AskChina - Is basketball not a popular sport in China? It’s surprising to me how Korea can beat China, considering it’s such an unpopular sport here that we don’t even get TV broadcasts.""","""Popular growing up as kid, not popular as a career like soccer. I said I wanted to be a soccer player and my mom said how many David Beckham are there in the world? That’s the end of the soccer dream.""",direct
195,"""What concerns you most about modern politics that needs attention?""","""The president is corrupt and not enough voters care""",direct
196,"""Most toxic gaming community?""","""Tbh, any gaming subreddit is fucking garbage. Everyone bitches about everything. “Oh no this is awful” “oh they fucked this up” “woke garbage”

It’s like if you stay off Reddit it’s always 100% better.""",off-topic
197,"""I don't like blackboards (please don't kill me). It is too expensive to buy the cool japanese chalk, and normal chalk leaves dust on your hands and produces an insufferable sound. It's also much harder to wash. i just don't understand the appeal.

Edit: I have thought about it, and understood that I have not tried a good blackboard in like 6 years? Maybe never?
Edit 2: I also always hated the feeling of a dry sponge""","""God forbid school administrators ever see a science fiction movie and start replacing whiteboards with clear glass that you write on.""",off-topic
198,"""Has Sports betting really ruined most sports? Is the damage really that big?""","""Get all the food for your workplace, all in one place""",off-topic
199,"""The Office. Good or Overrated?""","""Great for a lot of it but like any successful network shows it goes on too long to sustain it.""",direct
200,"""I struggle to define what topology actually is. Are there any short, pithy definitions that may not cover the whole field, but give a little intuition?""","""Point-set topology is the study of pathological spaces and counterexamples.""",direct
201,"""I'm so used to proofs having similar structure/methods for the forward and converse statements, but I'm curious if there are any statements that have completely different proofs for both directions. I'm talking maybe different fields of math required for both. Or something milder.

Or even if there are any facts that are comically easy in one direction and ridiculously difficult in the other.""","""Gödel's completeness theorem: Given a certain deductive system, a statement (in first order predicate logic) can be proven, iff the statement is true.

Provability here means a formal proof, and true is usually formalized with model theory. Technically, completeness is only one direction, but the completeness theorem is usually about both.

Depending on the deductive system, one direction is almost straightforward. If you are using a Hilbert system, just check that the axioms are true and that the inference rule modus ponens is sound.

The other direction however, every true statement is provable, is not so straightforward. I have no idea what Gödel did (his proof predates model theory), but Leon Henkin's modern proof (the one that is usually taught today) is significantly longer and requires more advanced techniques. Depending on your definition of first order predicate logic, you might even need the axiom of choice. The proof however is still simple in my opinion, but significantly different.""",direct
202,"""Hi guys! I'm a DP2 suffering from the unimaginable amounts of agony that is the Internal Assessments already screwed over history eshkedditttt

I was starting to write my IA on conditional probability (to be specific, the Doomsday Argument) when my teacher told me that it didn't feel like I completely understood the topic, which was somewhat true. I changed my topic to calculating the fuel efficiency of a slingshot maneuver, but decided it was too physics-oriented.

Could you guys lend me a hand with some not-so-generic IA topics? Something related to calculus would be nice""","""I did the Oberth maneuver for my Physics IA using Kerbal Space Program as a ""med-fi simulation"" lol. It was fun but I don't think you could get a high grade for it as a Maths IA.

Do not do anything related to stats unless you're absolutely certain you know everything there is. I made that mistake. Stats IAs are statistically historically graded lower compared to the other fields.""",direct
203,"""What is your take on people who say they’re not political or that they hate politics?""","""I agree to an extend tbh""",direct
204,"""nearly every mathematical space that i encounter (metric spaces, topological spaces, measure spaces, and even more abstract objects) seems to trace back in some way to the real numbers, the rational numbers, or the integers. even spaces that appear highly nontrivial, like berkovich spaces, solenoids, or moduli spaces, are still built on completions, compactifications, or algebraic extensions of these foundational sets. it feels like mathematical structures overwhelmingly arise from perturbing, generalizing, or modifying something already defined in terms of the real numbers or their close relatives.

are there mathematical spaces that do not arise in any meaningful way from the real numbers, the rationals, or the integers? by this, i don’t just mean spaces that fail to embed into euclidean space; i mean structures that are not constructed via completions, compactifications, inverse limits, algebraic extensions, or any process that starts with these classical objects. ideally, i’m looking for spaces that play fundamental roles in some area of mathematics but are not simply variations on familiar number systems or their standard topologies.

also, my original question was going to be ""is there a space that does not arise from the reals as a subset, compactification, etc, but is, in your opinion more interesting than the reals?"" i am not sure how to define exactly what i mean by ""interesting"", but maybe its that you can do even more things with this space than you can with the reals or ℂ even.""","""In theoretical computer science, there are interesting T0 topological spaces which are models of the untyped lambda calculus, i.e. sets D isomorphic to the continuous functions D->D.

These spaces don't arise from the reals, but from partial orders.""",direct
205,"""If someone asks me ""who is the actor in that film about blah blah"" and I say ""I'm 95% sure it's Tom Cruise"", then what I mean is that for 95% of these situations where I feel this certain about something, I will be correct. Obviously he is already in the film or he isn't, since the film already happened.

I see confidence intervals the same way. Yes the true value already either exists or doesn't in the interval, but why can't we say we are 95% sure it exists in interval [a, b] with the INTENDED MEANING being ""95% of the time our estimation procedure will contain the true parameter in [a, b]""? Like, what the hell else could ""95% sure"" mean for events that already happened?""","""However, you can say that the confidence interval will cover the true parameter to 95%.

That's the idea of confidence intervals. We check if the data supports the null hypothesis by constructing the confidence interval, which covers the true parameter to 95%. If the confidence interval covers the null (=fixed) parameter, then we choose not to reject the null hypothesis. If it doesn't cover the null parameter, we reject believe in the null hypothesis.""",related
206,"""Is everything we drink a suspension/solution/emulsion/etc. of one of these two liquids?""","""Short chain fatty acids (acetic, propionic and butyric acid) are liquids""",direct
207,"""Is kpop real music?""","""I don't think it's really up to an individual to decide what ""real music"" is.

People make it. People (can) listen to it.

The end.

Music.""",direct
208,"""Is basketball not a popular sport in China? r/AskChina - Is basketball not a popular sport in China? It’s surprising to me how Korea can beat China, considering it’s such an unpopular sport here that we don’t even get TV broadcasts.""","""It’s super fucking popular. It’s all students do during recess. My grandpa who’s almost 90 watches NBA. It’s just that the pro scene is embrassing.""",direct
209,"""What is your take on people who say they’re not political or that they hate politics?""","""Good as its run by clowns""",direct
210,"""Since 1965, we have had the FFT for computing the DFT in O(n log n) work. In 1973, Morgenstern proved that any ""linear algorithm"" for computing the DFT requires O(n log n) additions. Moreover, Morgenstern writes,

To my knowledge it is an unsolved problem to know if a nonlinear algorithm would reduce the number of additions to compute a given set of linear functions.

Given that the result consists of n complex numbers, it seems absurd to suggest that the DFT could in general be computed in any less than O(n) work. But how plausible is it that an O(n) algorithm exists? This to me feels unlikely, but then I recall how briefly we have known the FFT.

In a similar vein, the naive O(n3) matrix multiplication remained unbeaten until Strassen's algorithm in 1969, with subsequent improvements reducing the exponent further to something like 2.37... today. This exponent is unsatisfying; what is its significance and why should it be the minimal possible exponent? Rather, could we ever expect something like an O(n2 log n) matrix multiply?

Given that these are open problems, I don't expect concrete answers to these questions; rather, I'm interested in hearing other peoples' thoughts.""","""One thing to remember is asymptotic complexity doesn’t actually equal speed in practice.

For example, in large parallel settings the primary limitation of the FFT is the memory access pattern rather than complexity. In other words, you’re more limited by the fact that you have to do a lot of inefficient read/writes.

I’m highly skeptical that even if it were possible to get an O(n) FFT algorithm that you could also do it in only O(n) read/writes; if you can’t, then the runtime is still dominated by memory access and the algorithm would be pointless""",related
211,"""Hey all,

I went to a hackathon this weekend, and so many people were able to create these nice website UI's, with words that changed colors and the background was super colorful; I have no idea how any of this could've been created from scratch using just coding. I was wondering if someone could tell me how these UI's can be made in such a short time?""","""I've won hackathons before. Best tip is to practice with an existing team, as a team, and do mock hackathons.

If you know react, and what packages to download, you can build something in less than 12 hours.

First 4 hours might be planning and reading the docs, 4 hours of sleep, 4 hours to clean up and submit. 12 hours of productive coding.

We can break down the 12 hours even further if you want, but assume also each team member knows what they are doing and we can do it in parallel.

Initialize the git repo, frontend, backend and database on local host with a decided framework. Database can be hosted on the cloud. Frontend is probably react, or vue, with tailwind css or bootstrap as the UI framework or use another one with copy and paste components. Backend can be flask or django, or if you want, ignore backend completely and just connect frontend to the database directly. (don't do this with real production code). (takes around 1-2 hours)

Your team of four starts splitting up work. One or two guys start working on frontend with the UI framework. One guy working on util libraries and business logic as well as api and webhooks. Another guy working on the database. You may have a floater or a guy that finished early to do merges and resolving merge conflicts. (3-6 hours) Working in parallel will require constantly preplanning what tasks are important that have a lot of other tasks dependent on it and which tasks have a lot of dependencies itself. (but at this point you should be polishing up) (3-6 hours)

Cloud hosting is quick and easy nowadays, should only take 1-2 hours. It might take a while to figure out the dockerfile and which cloud hosting platform will help the most. If you know what you are doing, and use existing open source frameworks and solutions, you can cut down the time spent writing boilerplate code and just focus on connecting API calls and endpoints.

Just a few tips
Already find your team of four and practice with them before the competition. Treat it like a war game if you want. Go into what if scenarios and try and build real projects together.

Look into the hackathons previous winners and losers from previous hackathons. Try and figure out how the judges pick the winners.
Do the judges really care about ML technologies? or do they just care about fancy UI? Some judges care about how many microservices you used and/or how big your techstack us. Do a lot of preplanning to figure out what the judges like.

As the competition gets near, usually company names start appearing, judges names start appearing, as well as the challenge names. Do a lot of research on the companies and judges.

If you wanna score points from a company, look into what API libraries they might want you to use. If you want to score points with a judges, and they are industry or professor, do a challenge that they can relate to.

Never rebuild the wheel. Use other people's code. Use open source frameworks and code from github. No hackathon winner will ever build their entire stack. The use frameworks and existing solutions. The only thing they will build themselves are the connections between the frontend and the backend as well as the business logic.

Add as much techstack and bloat as you can. Host it on a bunch of microservices, use OAuth, host it on the cloud. Add infinite horizontal scaling. Judges for some reason like that, even if it does nothing for your app.

The app doesn't even have to work. It only needs to seem like it works.

Winning hackathons is a specific skill, and only some of it is transferable to actual industry. Over representing your app to judges probably isn't something you will do in industry, and hard coding stuff is probably something you won't do.

But the best tip is to just practice and get good at using other people's code.""",direct
212,"""Has Sports betting really ruined most sports? Is the damage really that big?""","""It’s not ruining sports it’s ruining sports fans""",direct
