ID,Post,Comment,Label
0,"""Is there a politician you strongly disagree with politically but still respect? Why?""","""Mamdani. Far too left for me but good personality, genuine and impressive victory.""",direct
1,"""How would you feel about Askreddit banning ""How Do You Feel"" posts about politics and current events?""","""Yes please. It's getting flooded with off-topic nonsense like ""how do you feel about news.... just go right to r/news and discuss it with everyone there?""",direct
2,"""Best sports stream site now? Since stream East isn't working, how do u guys watch football? Gimme some links guys help a brother out""","""dude was preparing for the Pereira fight""",off-topic
3,"""Is basketball not a popular sport in China? r/AskChina - Is basketball not a popular sport in China? It’s surprising to me how Korea can beat China, considering it’s such an unpopular sport here that we don’t even get TV broadcasts.""","""They haven’t cared since Yao Ming was in the NBA""",related
4,"""The Office. Good or Overrated?""","""Overrated is a silly word.""",related
5,"""Is Sabrina Carpenter a good artist?""","""I don't get her at all. There's something about her face that's just off and I don't mean attractiveness, she's just off. If it was revealed that she was a lizard person I would be like ""ya makes sense""""",related
6,"""Is Sabrina Carpenter a good artist?""","""She’s seems lovely. Her videos and/or music are a fun in small doses. I can see my wife’s blood pressure increase whenever I “sing” a verse of hers when Im cooking dinner, but then she laughs when I get to the part where I ask her not to make me cry, cause my makeup is *so* nice.

So thats a win.""",direct
7,"""I recently started learning complexity theory in my scheduling course. I was told many people believe P != NP, but wasn't provided any reasoning or follow-ups. So I do be wondering.

Any eye-opening explanations/guidance are welcomed.""","""Part of it is simply that all of our attempts to solve NP problems efficiently have failed. We can probe that if one is in P they all are, but none of them have yielded any results. We've been working on thr problem for a very long time now.

On top of that, there isnt really a sense of why they would be equivalent. If I have a vat of 1 billion balls, and one of those balls is red, but I can only draw out random balls, I can identify the answer instantly but it doesn't help me locate it. Identifying solutions and finding solutions are just different things.""",direct
8,"""nearly every mathematical space that i encounter (metric spaces, topological spaces, measure spaces, and even more abstract objects) seems to trace back in some way to the real numbers, the rational numbers, or the integers. even spaces that appear highly nontrivial, like berkovich spaces, solenoids, or moduli spaces, are still built on completions, compactifications, or algebraic extensions of these foundational sets. it feels like mathematical structures overwhelmingly arise from perturbing, generalizing, or modifying something already defined in terms of the real numbers or their close relatives.

are there mathematical spaces that do not arise in any meaningful way from the real numbers, the rationals, or the integers? by this, i don’t just mean spaces that fail to embed into euclidean space; i mean structures that are not constructed via completions, compactifications, inverse limits, algebraic extensions, or any process that starts with these classical objects. ideally, i’m looking for spaces that play fundamental roles in some area of mathematics but are not simply variations on familiar number systems or their standard topologies.

also, my original question was going to be ""is there a space that does not arise from the reals as a subset, compactification, etc, but is, in your opinion more interesting than the reals?"" i am not sure how to define exactly what i mean by ""interesting"", but maybe its that you can do even more things with this space than you can with the reals or ℂ even.""","""Finite group theory in general is pretty removed from anything having to do with R. Think about free groups, quotients of free groups, modules over rings, quotients of modules, etc.

Most of algebraic topology can be done without thinking about R.""",direct
9,"""People who swore an oath to defend the constitution of the USA against all enemies both foreign and domestic, how are you feeling right now?"" ","""As an Iraq war vet that was part of the invasion force in 2003...more disgusted than I was then.""",direct
10,"""Hi guys! I'm a DP2 suffering from the unimaginable amounts of agony that is the Internal Assessments already screwed over history eshkedditttt

I was starting to write my IA on conditional probability (to be specific, the Doomsday Argument) when my teacher told me that it didn't feel like I completely understood the topic, which was somewhat true. I changed my topic to calculating the fuel efficiency of a slingshot maneuver, but decided it was too physics-oriented.

Could you guys lend me a hand with some not-so-generic IA topics? Something related to calculus would be nice""","""actually, what do you mean ""too physics-oriented""? is that something that your teacher suggested or purely what you decided?

physics utilize math in explaining things, cool stuff, no prob with that

it becomes too physics-oriented for an IB Math IA if you just cherry pick already formulated physics equations, plug in values into them, get your results and make an analytical discussion about it.

aside from that, if you develop the equations, alter it to your needs (of finding the answer to your research) and gain results from that, then that would not be considered too physics, instead, it is just applied maths, which is EPICLY cool""",related
11,"""What did Newt Gingrich do to the Republican Party?""","""Since Newt Gingrich and Karl Rove the Republicans got increasingly treasonous.""",direct
12,"""Let’s Discuss: Who’s bigger, Taylor Swift or Michael Jackson?""","""MJ > Taylor""",direct
13,"""Who is the most globally recognized Athlete in history?""","""I'd guess a soccer player since thus sport is all over the world, but couldn't say who""",direct
14,"""What are your top albums of 2025 so far?""","""Only album I bothered to listen to in full is the new Franz Ferdinand one. Definitely worth a listen""",direct
15,"""I am aware that the fluoride toothpaste is Stannous fluoride or sodium fluoride. However, I thought that the primary method of harm was the free F- ion attacking the nerve electrolyte reuptake (the Ca and Na absorptions). In that case, the F- which is present in both HF and toothpaste formulas. So why doesn’t it hurt us when it’s in toothpaste?

To be clear, I am not asking what the benefits of using fluoridated toothpaste and drinking water is; the benefits are clear. I just what to know the chemical mechanism behind why it’s safe as a compound, but not as an acid, when the danger is in the F- ion which is still present in non acid compounds.""","""HF as an acid is weak and does not dissociate into just H+ and F- immediately. As a result, HF molecule can more effectively pass through the lipids/oils of your body and get to your nerves. That’s how I think about it, and I am a chemist. I don’t have a source on this but thought I’d share what I think makes sense.""",direct
16,"""Let’s Discuss: Who’s bigger, Taylor Swift or Michael Jackson?""","""MJ all the way

TS is never gonna be that historic""",direct
17,"""Why are East Asians so good at sports but not Taiwan? When I was young, I had a picture of Calvin Smith. He was the world record holder of the 100m at 9.93s and I would later find out the ""cleanest"" 100m athlete ever, never been caught for doing drugs. Next to him was a poster of Li Ning doing the pommel horse at the 1984 Olympics. Needless to mention China, which today competes with the USA for the top medals ranking at the Olympics, Korea and Japan also consistently feature in the top 5 and top 10 medals ranking. And Korea and Japan are now consistent world cup qualifiers at football. Even smaller nations like Malaysia is a powerhouse at badminton. When I was young, I would go to school with my bag and my badminton racket. Badminton clubs are oversubscribed and membership only available via lottery. What happened to Taiwan?""","""Taiwan is pretty good at baseball btw. Way better than China and pretty close to South Korean level. Of course not as good as Japan. But not many in the world can compete with Japan.""",related
18,"""Has Sports betting really ruined most sports? Is the damage really that big?""","""Sports betting has led to athletes getting harrassed. People will bet on an athlete, and they'll lose, and that leads to them getting a lot of harrassment including death threats.""",direct
19,"""How would you feel about Askreddit banning ""How Do You Feel"" posts about politics and current events?""","""I'd be happier if all the leading questions stopped""",direct
20,"""I am from Mechanical Engineering background and I used to think I kind of like math (as I loved trying to solve various different types of problem with trigonometry and calculus in my high school lol) but recently I decided I will relearn Linear Algebra (as in the course the college basically told us to memorize the formulas and be done with it) and I picked up a recommended maths book but I really couldn't get into it. I don't know why but I kind of hated trying to get my way through the book and closed it just after slogging through first chapter.

Thus in order to complete the syllabus I simply ignored everything I read and started looking at the topics of what are in Linear Algebra and started making my own notes on what that topic significance is, like dot product between two vector gives a measure of the angle between the vectors. And like that I was very easily able to complete the entire syllabus.

So I wanted to ask how you guys view math? I guess it is just my perspective that I view math as a tool to study my stream (let it be solving multitude of equations in fluid mechanics) and that's it. But when I was reading the math book it was written in the form that mathematics is a world of its own as in very very abstract. Now I understand exactly why is it that abstract (cause mechanical engineering is not the only branch which uses math).

Honestly I have came to accept that world of mathematics is not for me. I have enough problems with this laws of this world that I really don't want to get to know another new universe I guess.

So do you think the abstract way mathematics is taught make it more boring(? I guess?) to majority of people? I have found a lot of my friend get lost in the abstractness in the mathematics that they completely forget that it have a significance in what we use and kind of hate this subject.

Well another example I have is when I was teaching one of my friend about Fourier series I started with Vibration analysis we have taught in recent class and from there I went on with how Fourier transform can be used there. It was a pretty fun experimentation for me too when I was looking into it. I learned quite a lot of things this way.

So math is pretty clearly useful in my field (and I am pretty sure all the fields will have similar examples) so do you think a more domain specific way of learning math is useful? I have no idea how things are in other countries or colleges but in my college at least math is taught in a complete separate way to our domain we are on.

Sorry for the long post. Also sorry if there was similar posts before. I am new to this sub.""","""I think that's part of it, but the more significant part is probably cultural. It's also important that math is simply difficult to learn and understand for most people.

I once heard an Iranian person talk about how math is really respected in their culture, with a similar status like poetry and literature. There is no culture of virtue in ""I'm bad at math"" there, for example. In the US, that seems to be the standard attitude. But US culture has a long history of being anti intellectual, which is strange because the founding fathers were all intellectuals.""",direct
21,"""Why Chinese football⚽️ sucks? With a population of 1.4 billion and many Chinese people who like football, why are they not as good at football as other East Asian countries like South Korea and Japan? I wonder why.""","""Most chinese have that very same question Why our soccer team sucks""",related
22,"""I'm so used to proofs having similar structure/methods for the forward and converse statements, but I'm curious if there are any statements that have completely different proofs for both directions. I'm talking maybe different fields of math required for both. Or something milder.

Or even if there are any facts that are comically easy in one direction and ridiculously difficult in the other.""","""The open-mapping theorem is almost trivial in one direction and a bit complicated on the other.""",direct
23,"""So my stats professor just told my upper-level stats class that the use of R-squared values is one of the biggest mistakes made in statistics today. Here are some of his reasons for while we shouldn't use it.

1.) It does not measure goodness of fit because it can be arbitrarily low even when the model is correct, and close to 1 even when the model is wrong.

2.) It is also a pretty useless measure of predictability because it says nothing about prediction error and nothing about interval forecasts.

3.) It cannot be compared across datasets.

4.) It cannot be compared across untransformed and transformed models.

He has a few more reasons but they are in our notes and pretty long. I'm just been taught my entire life about R-squared and now he seems to be going in the complete opposite direction. I may be misinterpreting what he's saying about it, but I'm just curious if what he is saying is true? If you need more details on his reasoning I can show you the source where it comes from.

EDIT: Here are the notes containing his arguments. It starts on page 17. http://www.stat.cmu.edu/~cshalizi/mreg/15/lectures/10/lecture-10.pdf""","""All four points look correct to me; I find I have to point number 1 out to people regularly who seem to think low R2 means the model is wrong or something (and who think high R2 is automatically an indicator of a useful model).

I wouldn't go so far as to say R2 is useless (it does actually measure something, the proportion of the variance in the data explained by the model, which may have some uses if the assumptions hold up), but it's not nearly as important as a lot of people seem to think.

If you've got Cosma teaching you statistics, I have to say I'm as jealous. I wish I'd had someone like that, rather than some of the complete-wastes-of-space I did have at times.

I have a PhD in stats, I've worked as a statistician for decades, and I also teach it myself, mostly to postgrads, but I read Cosma's class notes when I get the chance (mostly for pleasure but sometimes to fill in the odd gap in my own knowledge). He's got a very good understanding and a clear writing style. He can sometimes be provocative, but I think that's a good thing -- I wouldn't say I always agree with his take, but his thoughts are always worth pondering, because he's nearly always dead on the money, and even when I think he isn't, he still has something worthwhile to say.

Listen to him and try to understand what he's getting at. Which of his points do you think are wrong? If you don't think any are wrong, you should thank him for pointing out you carried some misconceptions.""",direct
24,"""Who is the most underrated artist right now?""","""Me""",direct
25,"""People who swore an oath to defend the constitution of the USA against all enemies both foreign and domestic, how are you feeling right now?"" ","""Betrayed, ashamed, motivated... very motivated.""",direct
26,"""Has Sports betting really ruined most sports? Is the damage really that big?""","""Certain sports in certain countries, yes. Overall, no. I follow Premier League football. I'm quite confident it's match-fixing free, and I can enjoy it without thinking of laying a bet. It is deeply tainted by big money though, but not directly through betting.""",direct
27,"""How much do you spend on groceries per month? How much do you spend on groceries per month for a single person?""","""$800+ for me and my husband all organic everything and multiple diff kinds of meat each week. Trying to figure out how to spend less while still keeping our meals interesting/varied/protein-rich.""",direct
28,"""What are your thoughts about the resurgence of the Black Panther Party in response to the actions of ICE agents?""","""everyone else's advice is ""let the president's masked thugs hurt you, take video and hope that we'll be able to bring them to court at some unspecified later date"" so someone actually doing something intended to keep people safe is a welcome thing afaic""",direct
29,"""What is the best breakup song?""","""Are you angry or just sad?""",off-topic
30,"""Most Overrated Restaurant in Hamilton? Give me your hot takes. What’s a popular place in Hamilton that you just don’t understand the hype around.""","""Lobby. I don't get the hype.""",direct
31,"""How does this sub genuinely feel about talk shows?""","""I watch livestreamers talk about nothing for hours on Twitch so it's pretty Ironic.""",off-topic
32,"""I recently started learning complexity theory in my scheduling course. I was told many people believe P != NP, but wasn't provided any reasoning or follow-ups. So I do be wondering.

Any eye-opening explanations/guidance are welcomed.""","""Keep in mind, though, that there is an ""out"". If a problem can be checked in polynomial time it can also be computed in polynomial time - does not imply that it will be the same order. There might be, for example, a theorem that the order of computation is at least 100 times the order of checking. This is a counter to the position that if P=NP then everything would be easy to compute if you knew how.""",related
33,"""Hey everyone. I'm a soon-to-be IB student and I'm wondering whether I should choose chemistry as one of my subjects. I was never good at chemistry, but I'm currently very uncertain about what I want to study in university and I believe chemistry would open a lot of doors for me. I thought this would be a chance for me to prove to myself that I can somewhat do chemistry? Anyways, I am also considering physics which I think I would be a bit better at. What should I do?""","""I would suggest you not doing it for the sole reason of “I want to challenge myself with the subject”. The way you are saying it makes me think you want to go towards a STEM major that utilizes chem. If that’s the case, go for it. If you aren’t confident in HL go SL.

But if that’s not the case and you have no idea what field you want to major in, I would say take something that you enjoy doing. And if you don’t have personal preferences do the one that you are more confident in getting good grades in.

The last thing you want is going into DP2 and realizing you don’t enjoy chem, it won’t be useful to your major, and you aren’t getting the grades you want, all at the same time.""",direct
34,"""What saddens you about the political environment in 2026?""","""How so many people treat it like a sport. Everyone's all about the drama. If y'all want to see political change then maybe you should try running yourself see how much better you do. But you won't and we all know why.""",direct
35,"""Over the years I have seen many proofs that contain the line ""by symmetry, it follows that [relevant result]"". I've seen this in proofs in topics ranging from analysis, probability, algebra, differential equations, and more.

When is this phrase actually justified in a proof? Or better yet, if you were going to write out the proof in complete, gory detail, what would you need to exhibit in order to make this argument rigorous?

I'm assuming you would need to show the existence of some structure-preserving bijection, but what structure needs to be invariant? Are there rules of thumb for symmetry arguments in algebra, and separate rules of thumb for symmetry arguments in probability? Are there universal rules of thumb? Or perhaps, are there no rules of thumb, and should we actually avoid using the phrase ""by symmetry"" because it is too vague?""","""It's been a minute since I was in grad school, but I remember ""by symmetry"" meaning ""the argument looks exactly the same as this one but you do it for the other case"". It can be a fairly informal statement.""",direct
36,"""How would you feel about Askreddit banning ""How Do You Feel"" posts about politics and current events?""","""All for it. Let's limit the political crap here.""",direct
37,"""The Office. Good or Overrated?""","""Good""",direct
38,"""Some countries absolutely own certain sports. Which sports could India own in the future?""","""Not dominate but I feel we are significantly getting better at table tennis day by day (looking at the recent performances of Manav Thakkar and Diya Chitale/Manush Shah double pair)""",direct
39,"""I always felt like I was too stupid to be a good coder because of the stereotypes where I live. It's seen as a field for men and brilliant ones at that. So as a girl I always thought I'd never be good enough because well... I wasn't a guy.

Now I'm really enjoying coding and wondering if it's a specific type of person that can be a coder? Or does coding change your brain to make you better at it.

Do people that code experience a change in their mind? Problem solving? Analytical skills? Perspective on life?

Did those traits make good programmers? Or do good programmers develop those traits?""","""I believe so. I did QA for 5 years before becoming a dev for a year and going back to QA and I can say my testing has gotten better. Not only because I’m more technical but as a dev, I would have to do my research on dependencies and other potential places my changes might affect. I apply the same to my testing even more now.""",direct
40,"""How do you feel about California introducing a bill to ban former ICE agents from serving as police officers or teachers?""","""I think it’s just political theater. It’s highly unlikely that it’ll stand if challenged in court.""",direct
41,"""Is league still worth getting into for a new player?""","""As someone who is recently getting into league as well the games great but compared to other games the community is incredibly whiney and petty, which gets annoying at times""",direct
42,"""Do Americans think Russia is still a great power?""","""Not me! If you look at how horribly Russia has done against Ukraine it is amazing how horrible their military is.""",direct
43,"""If Trump is really mentioned in Epstein files so many times and the evidence is so damning, why would people in his administration (Bondi, Patel, et al) still be willing to protect a pedophile? Why do people continue to back this guy? Is their thirst for position and power so overwhelming?""","""Mutually assured destruction. There is enough wealth and power amongst all the monsters that if any one of them break the entire thing blows up.""",direct
44,"""can i learn to cook without actually cooking? hello, i really want to learn to cook since its a really important skill to have, but my mom doesnt let me inside the kitchen and says she will cook for me,, she wants me to depend on her and says after that my future wife will do the cooking for me,,which sounds yucky, can i learn to cook by just watching vidoes?""","""Not really but watching videos will at least help you get familiar with terminology and ingredients. Once you have your own place you can start learning. Don't be one of those guys who learns how to cook two things and gives up.""",direct
45,"""Is Hockey the national sports of India? Is Hockey the national sports of India? In school books, it's written that Hockey is the national sports of India. What's your opinion?""","""GOI has not declared any national sport. Before the 1980s, Hockey was the most popular sport in India (at least from what I have read). India won 6 consecutive Olympic gold medals from the British era to early independence. This Historical boom led many people to unofficially call it the national sport of India. We never had success of that magnitude after that due to poor sports infrastructure, mismanagement and the cricket boom.""",direct
46,"""Everyone has seen Cantor's diagonalization argument, but are there any other methods to prove this?""","""Not sure if this is circular, but it would be really funny to start by proving Heine-Borel, show that R is a perfect set, then use Rudin's proof that perfect sets in R^k are uncountable (given any countable sequence of points in a perfect set P, you can form a decreasing sequence of compact subsets where each element in the sequence is missed by at least one of the sets, then the intersection must be nonempty so must have an element not on the list).""",related
47,"""Thoughts on the state of Fortnite?""","""They made 6 Billion dollars in 2025 alone, from this small free game.""",related
