ID,Post,Comment,Label
351,"""So my boss recently told me that try-catch statements are ""garbage"" and that I should avoid using them when developing. This wasn't specific to any particular language - they seemed to mean it as a general programming principle. I'm pretty confused because I thought error handling with try-catch was fundamental to most modern programming languages. I know it can be misused (like catching exceptions and doing nothing, or using exceptions for control flow), but completely avoiding it seems extreme. Is there some programming philosophy or best practice I'm missing here? Are there alternatives to try-catch that are considered better? Or is my boss maybe referring to specific anti-patterns that I should be aware of? Has anyone else encountered this ""no try-catch"" philosophy? What are the actual best practices around exception handling across different languages? Any insight would be really helpful - I want to understand if there's something legitimate here or if I should push back on this guidance.

‐--------------------------------------------------------------------------------

When people say vague things like ""That's not good programming,"" I always ask, ""Why?"" Why is it garbage? Why is it bad design? Why isn't it good programming?

When I asked that, they said, ""You should at least make a program that doesn't produce errors,"" and then laughed at me.

Anyway, thanks for all the responses. I posted this because I was genuinely confused after that conversation and wanted to see if I was missing something obvious.""","""Usually when someone says try-catch is garbage, they really mean misusing it is garbage.

Best practice is simple:

Use try-catch only at boundaries (API calls, DB, file I/O)
Don’t use it for normal control flow
Don’t swallow errors—handle or rethrow them
Exceptions aren’t bad. Lazy exception handling is.""",direct
352,"""What is the best breakup song?""","""Somebody That I Used to Know""",direct
353,"""What should Chinese Soccer have to do to surpass Korea and Japan?""","""Clean up corruption at all levels of the sport""",direct
354,"""Hey everyone. I'm a soon-to-be IB student and I'm wondering whether I should choose chemistry as one of my subjects. I was never good at chemistry, but I'm currently very uncertain about what I want to study in university and I believe chemistry would open a lot of doors for me. I thought this would be a chance for me to prove to myself that I can somewhat do chemistry? Anyways, I am also considering physics which I think I would be a bit better at. What should I do?""","""I was more interested in bio + chem than physics. I thought I would enjoy bio more than chem, and I simply did chem because it would open more opportunities for me since more stem majors require chem HL. I got a 6 for bio and ended up getting 4 for chem. If you're really interested I'm sure you can do it, I found it difficult for me though.""",related
355,"""Is kpop real music?""","""Any form of expression is art.""",direct
356,"""I had an R class and enjoyed the tool quite a bit which is why I dug my teeth a bit deeper into it, furthering my knowledge past the class's requirements. I've done some research on data science and apparently Python seems to be growing faster in the industry and in academia alike. I wonder if I should stop sinking any more time into R and just learn Python instead? Is there a proper GGplot alternative in Python? The entire Tidyverse package is quite useful really. Does Python match that? Will my R knowledge help me pick up Python faster?

Does it make sense to keep up with both?

Thanks in advance!

EDIT: Thanks everyone! I will stick with R because I really enjoy it and y'all made a great case as to why it's worthwhile. I'll dig into Python down the line.""","""As everybody said - python is a much clearer language.

However on point that wasn't mentioned is that a lot of R packages are accompanied by a scientific publication. Which means they went through an academic review process. Also makes it much nicer to argue why you chose a library/method.""",related
357,"""What non-political opinion gives away someone's politics?""","""“My body my choice” leans both ways these days, just depends what their referring to""",direct
358,"""How strong should you be to play curling? Hey all, i was thinking how strong you should be (especially in your arms) to play at least decently. I have seen some interviews and players sometimes say that throwing the stone doesn't require much strength, but i was wondering if that's true (maybe they are so trained that they minimize the actual effort). Also i was thinking that maybe sweeping is actually more difficult or i might be totally wrong, and maybe the strength come from your lower parts. I am trying to join a curling association/team to try the sport, but i've never been a ""sporty"" guy, and i am not so trained. thank you everyone in advance""","""For throwing most of the strength you need is in your legs and core. Upper body strength for sweeping. But truthfully so many good curlers I've seen aren't very strong. Technique definitely is the primary factor. 13""",direct
359,"""What do you guys think about fireworks?""","""Are people allowed to use them the whole year in your country? Or am I again too literal?""",related
360,"""Hey everyone,

I just started my first ever job as a junior dev last week (fresh out of school), and honestly it already feels like a disaster. I’m starting to question myself a bit.

My first day was Monday, and by Friday I was already in home office. Same today too and Monday too. The only office days are Wednesday and Thursday, which feels a bit sad because I’m brand new and immediately working from home with barely any guidance is to much.

I never really got a proper introduction to the project, the systems, or how tickets are normally solved. My very first ticket was basically: “Yo, look in our system, I have a ticket for you, try to solve it. If you have questions, ask me…” That’s it. No walkthrough, no explanation of where to start. I asked how they usually approach tickets or where to even find the relevant code, but I still felt pretty lost.

To be fair, I did get a decent intro into the running software itself, so I kind of understand the product. But that’s where it ended. Meanwhile, I see other people who started just a month before me sitting next to their team lead getting tons of explanations and support.

Somehow I managed to solve 3 tickets (a mix of with and without help), but most of the time I have nothing to do. I’m just sitting here, bored, not knowing what I should be learning or focusing on.

I’ve tried to be proactive and ask what I could look into:

Yesterday I asked if there were patterns or frameworks I should study. The response was just: “Take a look at EF and how we make the models"" EF and setting up a config for models isnt that hard so I understood it quite fast.

Today I asked again and just got sent some tickets to read through “to see if I understand what the customer wants.” which is so overwhelming.

Another coworker told me to check out their validation logic cause I will be working with this part of the project, but there are a ton of files with different rules and it’s overwhelming to dig into alone at home.

So now I’m just sitting here wondering: am I doing something wrong? Is it normal to feel this lost and useless in the first week? Or did I pick the wrong career path entirely?

It’s super frustrating because I want to learn and contribute, but right now it feels like I’m just drifting.

Has anyone else been in this situation? Is this just how the start usually feels, or is this a red flag?""","""Hi! This is how most junior developers feel. I also felt this way. I was working remote and I wasn’t working on a product, but on a proof of concept technology that was used later in a project. We didn’t do tickets as we were only 2 in the team working on it so I can’t help on this side. But what I did to work it out: - Asking my senior a lot of questions. My luck was that this guy was available all the time to explain, live debugging in calls and whatnot. - Running available tests on the product on my local. Writing tests to better understand architecture. Anything odd? Ask away. - Reading and building on my own using the technologies used. - Use google a lot. Now you can also use GPT, but I’d recommend using it with caution. Don’t generate AI slop code, but ask for theory, concepgts in the language(s) that are used in your product.

After 4 years and with a different project at hands, I can tell you you’ll never escape this feeling completely. It will come back, but it matters most what you can do to overcome it. Get results, analyse and learn while building. Good luck!

(english is not my main language sorry for any typos)""",direct
361,"""Is basketball not a popular sport in China? r/AskChina - Is basketball not a popular sport in China? It’s surprising to me how Korea can beat China, considering it’s such an unpopular sport here that we don’t even get TV broadcasts.""","""China when it comes to Athletics makes the mistake of not exporting their athletes overseas to the top leagues. It stunts the growth of their players that are good enough to rise to that level. You see it in soccer as well. Their top talent never reaches their full potential because they have to stay in China instead of being able to play in other leagues elsewhere""",related
362,"""Is everything we drink a suspension/solution/emulsion/etc. of one of these two liquids?""","""Some lactones can technically be consumed and they are liquid, though many of them have psychoactive effects, famously GBL and it’s corresponding carboxylic acid GHB are active as powerful sedatives.""",direct
363,"""Is everything we drink a suspension/solution/emulsion/etc. of one of these two liquids?""","""Oil. Oils are liquids. But yea as far as bulk fluids, it’s going to be some version of water or ethanol.""",direct
364,"""Parmesan rind substitute? I keep being intrigued with recipes that turn out to call for a parmesan rind. Which I've never had and can't honestly say I expect to have, really - I just don't use parmesan much. I'm assuming that for the usual (soup or stew) recipes that call for this, probably throwing in an equivalent weight of actual cheese is not the answer 😂 So... what's my best bet? MSG? Fish sauce? Something else? Just shrug and omit it? Pass on the recipe altogether?""","""There can be only one!""",direct
365,"""How can anybody still support Trump?""","""There are still people who support Hitler my dude. A lot are the same who back Trump. Idiocy refuses to die.""",direct
366,"""Why is harry potter so good?""","""Because JK Rowling writes the book as it were for children, which it is. She writes Harry Potter in a way as if you were there, in third person, and as if you need things explained to you as if you were 7 years old. Nothing wrong with that. Nothing bad about it either.""",direct
367,"""Is league still worth getting into for a new player?""","""You’ll get addicted. Run while you can.""",direct
368,"""What do you guys think about fireworks?""","""Currently sitting at my kitchen table with my noise cancelling headphones, listening to Cabaret lol.""",off-topic
369,"""Is Sabrina Carpenter a good artist?""","""Sabrina Carpenter, Taylor Swift, etc

These are 2 wildly diffent artists.""",related
370,"""How can there be a rise of Neo-Nazism in America when Israel is one of their closest allies?""","""They believe Jesus will come back in the east side of Jerusalem which I believe is where his tomb was. That area is currently controlled by the West Bank so helping Israel ""resettle"" helps hurry along the process. Jesus is supposed to come back when Israel is being restored whole basically.

Comically he's supposed to be riding a donkey when he comes back lmao. Uncomically it's gonna include a bunch of rape :(.

But yes OP this is why so many Christian Natinalosts are pro Israel. One Jesus comes back Israel is either supposed to convert to Christianity or be destroyed, so in the Christian timeline the Israelis aren't gonna fair too well.

Israel knows their is their distorted hope and doesn't care.""",direct
371,"""Who is the most globally recognized Athlete in history?""","""Definitely a footballer. Probably Cristiano Ronaldo. Americans of Reddit sometimes forget the rest of the world exists.""",direct
372,"""Those who have quit social media. Did you life get better/worse?""","""I have strict timers I do not cheat on for IG and Reddit. It makes me so cognizant of the time im spending, and when I’m done for the day, I’m done.""",direct
373,"""Those who have quit social media. Did you life get better/worse?""","""Better. I haven't been nearly as anxious since leaving social media completely (outside of YouTube and Reddit lol), and I haven't fallen into a depressive slump in two years despite having SAD""",direct
374,"""So my stats professor just told my upper-level stats class that the use of R-squared values is one of the biggest mistakes made in statistics today. Here are some of his reasons for while we shouldn't use it.

1.) It does not measure goodness of fit because it can be arbitrarily low even when the model is correct, and close to 1 even when the model is wrong.

2.) It is also a pretty useless measure of predictability because it says nothing about prediction error and nothing about interval forecasts.

3.) It cannot be compared across datasets.

4.) It cannot be compared across untransformed and transformed models.

He has a few more reasons but they are in our notes and pretty long. I'm just been taught my entire life about R-squared and now he seems to be going in the complete opposite direction. I may be misinterpreting what he's saying about it, but I'm just curious if what he is saying is true? If you need more details on his reasoning I can show you the source where it comes from.

EDIT: Here are the notes containing his arguments. It starts on page 17. http://www.stat.cmu.edu/~cshalizi/mreg/15/lectures/10/lecture-10.pdf""","""It is very similar to the problem of p-values that has become such a hot topic these days. The situations where it is used vastly outnumber the situations where it is appropriate. There are certain models where Rsq is informative, but many where its use may be deceptive or downright wrong. This is why there are so many different model performance metrics (AIC, BIC, Rsq, etcetcetc). They all have their applications, but are not necessarily useful for all models.""",related
375,"""Is there a politician you strongly disagree with politically but still respect? Why?""","""Mitt Romney. I’d take him over Trump any day.""",direct
376,"""Is pokemon worth watching?? (i don’t want to watch 800+ episodes so only important seasons)""","""Yes definitely.

I even recommend to begin with the first season, a timeless classic.""",direct
377,"""Hey everyone,

I just started my first ever job as a junior dev last week (fresh out of school), and honestly it already feels like a disaster. I’m starting to question myself a bit.

My first day was Monday, and by Friday I was already in home office. Same today too and Monday too. The only office days are Wednesday and Thursday, which feels a bit sad because I’m brand new and immediately working from home with barely any guidance is to much.

I never really got a proper introduction to the project, the systems, or how tickets are normally solved. My very first ticket was basically: “Yo, look in our system, I have a ticket for you, try to solve it. If you have questions, ask me…” That’s it. No walkthrough, no explanation of where to start. I asked how they usually approach tickets or where to even find the relevant code, but I still felt pretty lost.

To be fair, I did get a decent intro into the running software itself, so I kind of understand the product. But that’s where it ended. Meanwhile, I see other people who started just a month before me sitting next to their team lead getting tons of explanations and support.

Somehow I managed to solve 3 tickets (a mix of with and without help), but most of the time I have nothing to do. I’m just sitting here, bored, not knowing what I should be learning or focusing on.

I’ve tried to be proactive and ask what I could look into:

Yesterday I asked if there were patterns or frameworks I should study. The response was just: “Take a look at EF and how we make the models"" EF and setting up a config for models isnt that hard so I understood it quite fast.

Today I asked again and just got sent some tickets to read through “to see if I understand what the customer wants.” which is so overwhelming.

Another coworker told me to check out their validation logic cause I will be working with this part of the project, but there are a ton of files with different rules and it’s overwhelming to dig into alone at home.

So now I’m just sitting here wondering: am I doing something wrong? Is it normal to feel this lost and useless in the first week? Or did I pick the wrong career path entirely?

It’s super frustrating because I want to learn and contribute, but right now it feels like I’m just drifting.

Has anyone else been in this situation? Is this just how the start usually feels, or is this a red flag?""","""Onboarding can be brutal, and some of your first tasks should be notes about the onboarding process. What helped and hindered your starting experience. Personally, I've only ever been fully remote, and I thrive in it, but it isn't for everyone. You have to be really comfortable asking questions. You'll also be learning what a stupid question is to ask some devs. The first week usually feels like no progress. I don't think I solved any real tickets at all in my first weeks at any of my jobs. It was always learning the code base setting up my environment. Maybe having a small baby ticket like add yourself to the team page. Nothing of any true substance. You can also do virtual pair programming or watch someone else debug their code base. You can also ask your leader what they expect our of your first weeks and months to help you feel more comfortable with expectations.""",related
378,"""As someone who has never cooked before how do I get into the world of cooking and make it a hobby? Share your answer""","""Don't bother with a bunch of cookbooks. Instead use websites like Serious Eats that explain all the steps in detail. Get an instant read thermometer so you understand when things are done. If you don't have one, get a decent fry pan and a sharp knife. Then just experiment until you are confident with the process.""",direct
379,"""What should Chinese Soccer have to do to surpass Korea and Japan?""","""Not suck""",direct
380,"""How do you feel about board games?""","""I love board games- it’s my main hobby- but I often want to play games I am familiar with (I have to be in a particular mood to learn a new game, especially if it’s not something that grabs me with a truly novel or SpIn adjacent  theme/components). """,direct
381,"""As someone who has never cooked before how do I get into the world of cooking and make it a hobby? Share your answer""","""What do you normally eat?""",off-topic
382,"""Why does sports betting seem like it's something you could easily profit on but you really can't?""","""Parlays & efficient lines will erase your bankroll in a heartbeat.""",related
383,"""Most toxic gaming community?""","""League of Legends. The toxic levels of that game are so high that the only people playing there are competitive sweats on a 10 hour loss tilt streak.""",direct
384,"""Years ago, somone asked me why m was used for slope, and I guessed it stood for something in French or German or something. And then discovered that no one is entirely sure. (Again, I assumed some mathematican used it in a journal and it caught on.)

Anyway, I was asked about the h and k, and my answer was usually that the letters were available. I remember using i and j in matrix algebra many years ago, and then again when I learned BASIC and Fortran but I didn't know if that was connected.

My Google-fu seems weak on this question.""","""They're just the only letters that are kind of left.

In conic sections, a, b, and c are used for major and minor axes of an ellipse or hyperbola, following the Pythagorean theorem. Those are important, intrinsic, coordinate-free properties of conic sections, so they get the start of the alphabet.

The end of the alphabet starting around u and v is used for free variables.

s and t are used for parameters in parametric equations.

The variables i and j are kind of already taken for indices.

The variables m and n and sometimes l already are taken for natural numbers. Of course, m is also already taken for slope.

p and q are taken for denoting points.

d is taken for diameter.

e is taken for eccentricity.

So h and k... are kind of just leftovers. I assume it's just tradition going back to Descartes, the likely originator of the notation, but I can't be arsed to go dig in primary sources to see if it's there.""",direct
385,"""Hi everyone,

I’m really new to both programming and GitHub. I recently created an account hoping to learn how to collaborate on projects and track my code like developers do, but to be honest... I still don’t understand anything about how GitHub works or how I’m supposed to use it.

Everything feels overwhelming — branches, commits, repositories, pull requests… I’m not even sure where to click or what to do first.

Can anyone recommend super beginner-friendly tutorials, videos, or guides that helped you when you were just starting out? I’d really appreciate any step-by-step resources or even personal advice.

Thanks in advance for your kindness and support!""","""A combination of Copilot, a cheat sheet, and a friend pointing out the common daily commands, helped me get github connected and happening. Its own documentation is hilariously lacking, iirc one of my issues was even figuring out where the signup button was.

I was close to setting up gitea last week on a file server but I forget what got in the way. A combination of the Ubuntu 22.04 base and some port configuring I was too asleep for at the time.""",direct
386,"""Does this generation watch Harry Potter?""","""It's just not my type of series.I much prefer star wars""",direct
387,"""Important question: Was Friends actually funny?""","""Dear Lord I thought I had stumbled into the Millennials sub for a second. So much negativity in this thread.""",off-topic
388,"""Important question: Was Friends actually funny?""","""Of course it is. It's a sitcom. Sitcoms are all the same formula.""",direct
389,"""How drastically has your political views changed within the last 10 years or so and why?""","""I went from voting democrat but not really caring too much to voting democrat and caring way too fucking much.""",direct
390,"""While on my honeymoon in Rome six years ago I had a whipped cheesecake that I've thought about almost every day since and it's slowly driving me mad. Could I possibly recreate this at home? The chief at Pianostrada in Rome didn't know how much her cheesecake was going to be living rent free in my head for over half a decade, but here we are. While on my honeymoon in Italy I had a whipped cheesecake at restaurant Pianostrada that I simply cannot stop thinking about. Easily one of the top five things I've ever eaten, and now I'm on a mission to try and recreate it. I know the people of Italy have access to higher fat milks and cheeses, allowing for greater flavors than what I can access here in Canada, but I need to at least try to make this at home. I can make a pretty good bake or non bake regular cheesecake at home, but I NEED this beautiful light and airy cheesecake in my life again, even if it's half as good I'll be happy. Could any of you suggest how to create a cheesecake that had a smooth flavor, without the brightness (lemon zest?) you usually find in homemade cheesecake, it was piped onto the plate (not necessary, I'd be fine to just scoop it out of a bowl), but with a texture of almost like a moose, the opposite of a usually dense cheesecake. Any pointers would be great, Thanks all. I've found a photo of it from a review. https://imgur.com/a/XPHWBfK""","""From the photo I would say the main fancy thing here is whipping siphon for the ""cheesecake"". Everything else is standard dessert stuff. I see people saying piping bag, it looks too smooth and airy imo for piping bag, but it would also be close either way. Whipping siphon = instant whipped cream at home. Starbucks uses them all the time as a good example. I would do 50/50 mascarpone and heavy cream, sugar to taste, splash of vanilla, blend it super well and then strain into the whipping siphon. Add a bit of milk or more cream if it's too thick, you want it sort of runny to avoid clogging. From there add your cake crumbles, berries, and chocolate. This should be one of those things that look super fancy and is actually stupid easy to make at home.""",direct
391,"""Does this generation watch Harry Potter?""","""I cry almost every time especially for Dobby 💔""",related
