ID,Post,Comment,Label
500,"""Derivatives were conceptualized originally as the slope of the tangent line of a function at a point. I’ve done 1.5 years of analysis, so I am extremely familiar with the rigorous definition and such. I’m in my first semester of algebra, and our homework included a question derivatives and polynomial long division. That made me wonder, is there a purely algebraic approach rigorous approach to calculus? That may be hard to define. Is there any way to abstract a derivative of a function? Let me know your thoughts or if you’ve thought about the same!""","""It depends what you mean. There isn’t really an algebraic approach to defining the derivative of a smooth function in general as it fundamentally relies on certain limits of real numbers. (Sure, you can recover the definition of a limit in a metric space using category theory(eg. in Riehl’s book), but this is merely a curiosity IMO.) To do calculus in algebraic areas of math, you usually restrict yourself to a much more special situation, like the case of polynomials/power series, where the derivative takes an algebraic form via the power rule. This has extended to a larger study of infinitesimal data in algebraic areas of math (eg. algebraic geometry) by considering derivations as (co)tangent vectors but in practice, this is understood explicitly only in polynomial or power series settings.

For example, let k be an arbitrary field and consider functions k -> k. What does it mean for such a function to be differentiable? There really isn’t a nice definition (indeed k isn’t even endowed with a natural topology) and because of this, it is more convenient geometrically to restrict to polynomial functions at the price of extreme rigidity.""",direct
501,"""What problem in the U.S. feels obvious to fix, yet never gets fixed?""","""The ridiculous cost of university education.""",direct
502,"""What’s stopping a normal person from becoming president in the US?""","""Money. Trump spent a billion in the last election (300 million from Musk). Harris spent a billion in the last election. Normal people do not have access to that kind of cash.""",direct
503,"""Is there a politician you strongly disagree with politically but still respect? Why?""","""Many. Mitt Romney, Liz Cheney come to mind""",direct
504,"""Why is harry potter so good?""","""Since it's a more modern/real life take on magic and wizards. With a lot of stuff that people can familiarise with. Instead if most wizards being like merlin""",direct
505,"""Most toxic gaming community?""","""You said it in the title. “Gaming community”.""",related
506,"""Is anime more mainstream than western cartoons?""","""Compared to American TV cartoons outside of The Simpsons or Family Guy? Yes. Compared to Pixar/Disney movies? No.""",direct
507,"""Most Overrated Restaurant in Hamilton? Give me your hot takes. What’s a popular place in Hamilton that you just don’t understand the hype around.""","""Based on this comment section, the better question seems to be are there any restaurants that arent overrated. Seems like everyone got a roasting here.""",related
508,"""Did republican america over hype turning point's halftime show for the super bowl?""","""OMG it was so bad. Like Russian dash cam video bad. It looked like it was filmed in the Death Star. The Star Spangled Banner was just embarrassing. If you want to check it out without giving it any views, Pat Finnerty did a live stream roast on youtube: https://www.youtube.com/live/iahH1fJoGB8?si=ZzncKkwwJPmc0Tf4&t=1495""",direct
509,"""Important question: Was Friends actually funny?""","""It was a moment in time.

Sadly(?) that moment has largely passed.""",related
510,"""How would you feel about Askreddit banning ""How Do You Feel"" posts about politics and current events?""","""I’m more for banning the “how do you feel about (story that is wildly misleading or derived)” posts""",direct
511,"""How do you feel about board games?""","""My brother and sister are both VERY into board games, but over time I’ve been banned from playing (including the computer game Civilisation) cos they get too annoyed at how in between turns I walk off to do something or get distracted and go on my phone. """,related
512,"""What sport do you play?""","""american football""",direct
513,"""Do you believe Tennis as a sports can grow in India? r/GenZIndia - VDiA Sania Mirza (Tennis) Manika Batra (Table Tennis) JaRA Table Tennis especially if we look at Olympics. What's your thoughts?""","""Reminded me of that father who murdered her own daughter""",off-topic
514,"""Hey, I’m an M26 student and I’ve got a few questions about Physics HL. I feel like I’m not studying the right way lol.

How do you even get a 7 in Physics HL? Is it actually possible? What resources do you use to practice? Any tips or tricks would be super helpful.

Also, how do you study in the month before the exam? Like, what’s your way of revising and making sure you're ready?""","""Reddit not letting me comment my method so I just dmed it to you""",off-topic
515,"""What did Newt Gingrich do to the Republican Party?""","""He began the era of “screw their feelings, screw the facts, just repeatedly say these phrases over and over on TV, and don’t compromise, and we’ll win” politics.

He knew he was morally wrong during the Clinton Lewinsky trials, but kept trying to play up how corrupt democrats were while he himself was having an extramarital affair. It didn’t matter to him though-it was more important to win than be kind or correct.

Here we are today.""",direct
516,"""How does this sub genuinely feel about talk shows?""","""In general they are funny to start of with but after a few years they all are the same round of ""celebs"" touring selling their chit.""",direct
517,"""I am from Mechanical Engineering background and I used to think I kind of like math (as I loved trying to solve various different types of problem with trigonometry and calculus in my high school lol) but recently I decided I will relearn Linear Algebra (as in the course the college basically told us to memorize the formulas and be done with it) and I picked up a recommended maths book but I really couldn't get into it. I don't know why but I kind of hated trying to get my way through the book and closed it just after slogging through first chapter.

Thus in order to complete the syllabus I simply ignored everything I read and started looking at the topics of what are in Linear Algebra and started making my own notes on what that topic significance is, like dot product between two vector gives a measure of the angle between the vectors. And like that I was very easily able to complete the entire syllabus.

So I wanted to ask how you guys view math? I guess it is just my perspective that I view math as a tool to study my stream (let it be solving multitude of equations in fluid mechanics) and that's it. But when I was reading the math book it was written in the form that mathematics is a world of its own as in very very abstract. Now I understand exactly why is it that abstract (cause mechanical engineering is not the only branch which uses math).

Honestly I have came to accept that world of mathematics is not for me. I have enough problems with this laws of this world that I really don't want to get to know another new universe I guess.

So do you think the abstract way mathematics is taught make it more boring(? I guess?) to majority of people? I have found a lot of my friend get lost in the abstractness in the mathematics that they completely forget that it have a significance in what we use and kind of hate this subject.

Well another example I have is when I was teaching one of my friend about Fourier series I started with Vibration analysis we have taught in recent class and from there I went on with how Fourier transform can be used there. It was a pretty fun experimentation for me too when I was looking into it. I learned quite a lot of things this way.

So math is pretty clearly useful in my field (and I am pretty sure all the fields will have similar examples) so do you think a more domain specific way of learning math is useful? I have no idea how things are in other countries or colleges but in my college at least math is taught in a complete separate way to our domain we are on.

Sorry for the long post. Also sorry if there was similar posts before. I am new to this sub.""","""I remember in elementary school, one of the standard punishments was to be assigned pages of math problems to do over recesses.

Math. As Punishment.

Gee. I wonder why people hate math.""",related
518,"""Why do r*dditors pretend that the majority of americans don‘t support Trump?""","""With the asterisk, I have to assume this is some kind of attempt at satire.""",off-topic
519,"""Since 1965, we have had the FFT for computing the DFT in O(n log n) work. In 1973, Morgenstern proved that any ""linear algorithm"" for computing the DFT requires O(n log n) additions. Moreover, Morgenstern writes,

To my knowledge it is an unsolved problem to know if a nonlinear algorithm would reduce the number of additions to compute a given set of linear functions.

Given that the result consists of n complex numbers, it seems absurd to suggest that the DFT could in general be computed in any less than O(n) work. But how plausible is it that an O(n) algorithm exists? This to me feels unlikely, but then I recall how briefly we have known the FFT.

In a similar vein, the naive O(n3) matrix multiplication remained unbeaten until Strassen's algorithm in 1969, with subsequent improvements reducing the exponent further to something like 2.37... today. This exponent is unsatisfying; what is its significance and why should it be the minimal possible exponent? Rather, could we ever expect something like an O(n2 log n) matrix multiply?

Given that these are open problems, I don't expect concrete answers to these questions; rather, I'm interested in hearing other peoples' thoughts.""","""My research area is matrix analysis, and my general feeling is that most people in my field expect the exponent of matrix multiplication to be 2, not 2.37…. The current exponent is a result of the current tensor laser methods being difficult to push any farther, not a result of what most people think of as an inherent barrier.

Edit: as I mentioned in a reply already, “exponent of matrix multiplication” refers to the smallest k such that matrices can be multiplied in O(nk+eps) operations for any eps>0.""",related
520,"""How do you feel about Trump threatening to impose photo ID for voters for midterm elections?""","""We’ve always had to? In Missouri, I’ve had to show my ID at any voting polls. It’s been like that at least 15 years, just from what I’ve seen with my own eyes.""",related
521,"""Parmesan rind substitute? I keep being intrigued with recipes that turn out to call for a parmesan rind. Which I've never had and can't honestly say I expect to have, really - I just don't use parmesan much. I'm assuming that for the usual (soup or stew) recipes that call for this, probably throwing in an equivalent weight of actual cheese is not the answer 😂 So... what's my best bet? MSG? Fish sauce? Something else? Just shrug and omit it? Pass on the recipe altogether?""","""Whole Foods sells the rinds from the cheese they grate.""",related
522,"""nearly every mathematical space that i encounter (metric spaces, topological spaces, measure spaces, and even more abstract objects) seems to trace back in some way to the real numbers, the rational numbers, or the integers. even spaces that appear highly nontrivial, like berkovich spaces, solenoids, or moduli spaces, are still built on completions, compactifications, or algebraic extensions of these foundational sets. it feels like mathematical structures overwhelmingly arise from perturbing, generalizing, or modifying something already defined in terms of the real numbers or their close relatives.

are there mathematical spaces that do not arise in any meaningful way from the real numbers, the rationals, or the integers? by this, i don’t just mean spaces that fail to embed into euclidean space; i mean structures that are not constructed via completions, compactifications, inverse limits, algebraic extensions, or any process that starts with these classical objects. ideally, i’m looking for spaces that play fundamental roles in some area of mathematics but are not simply variations on familiar number systems or their standard topologies.

also, my original question was going to be ""is there a space that does not arise from the reals as a subset, compactification, etc, but is, in your opinion more interesting than the reals?"" i am not sure how to define exactly what i mean by ""interesting"", but maybe its that you can do even more things with this space than you can with the reals or ℂ even.""","""Lattices and categories are extensively studied, yet barely have anything to do with numbers. You can slap a topology on top of a lattice if you want it to be a space.

Syntactic ""spaces"" in logic - formal languages, theories, entailment systems, institutions, etc. - are also quite removed from the real numbers. Even though the natural numbers can encode them.""",direct
523,"""How drastically has your political views changed within the last 10 years or so and why?""","""I was a bog-standard liberal for most of my life, the kind of guy who thinks if we just turn the dials a few clicks in the right direction it’ll work out better for most of us.

Then I went to work for a Fortune 100 company.

Now I want the gutters to run red with the blood of the aristocracy.""",direct
524,"""Those who have quit social media. Did you life get better/worse?""","""LinkedIn is stupid and vain now. I hate it.""",related
525,"""What's your honest opinion on Tinder?""","""Thought about trying a dating app, like paying for a month or something, downloaded one app, made a dumb profile, and deleted it because all the women are hot, and I'm just not.""",related
526,"""Former cooks/chefs, what do you do now? Been in the industry about 15 years and honestly getting a bit burnt out. I use to love cooking but the passion is fading. Ive recently begun quitting weed (going from heavy user to a lot less and now weaning off of it) and have been dabbling with the idea of leaving the industry since weed has really been the only thing holding me back from other jobs and the knowledge that even loving to cook I dont want to do this the rest of my life. So Former cooks, what do you do now and how did you get into it? Do you like it?""","""I'm 33 and just got into law school, chef""",direct
527,"""Is among us good?""","""yess it is quite fun to play it

better if you have friends to play with tho""",direct
528,"""Is league still worth getting into for a new player?""","""NO STAY AWAY PLEASE ITS BAD""",direct
529,"""Is everything we drink a suspension/solution/emulsion/etc. of one of these two liquids?""","""Even the ethanol drinks have a higher concentration of water 99% of the time""",related
530,"""Where does the water go if you light a balloon of hydrogen on fire? How can it get hot and produce water at the same time? Do you just get super heated vapour?""","""In short: yes, you just get super heated vapour! Plus the N2 in air is also heated to similar temperature, and the gas expands proportionally to T.

And that is really hot: in regular air, a simple open flame at constant pressure reaches 2,100°C, while confined (constant volume) explosion can get to 2,400°C. For comparison, the hottest (blue) part of candlelight is only 1,400°C!""",direct
531,"""Why do r*dditors pretend that the majority of americans don‘t support Trump?""","""Reddit is a leftist echo chamber. They downvote anyone they disagree with. They thought Kamala would win by a landslide. You can see it recently with the ICE killing. Left sees the mom as innocent while the right sees her driving right at the agent.""",direct
532,"""Do you believe Tennis as a sports can grow in India? r/GenZIndia - VDiA Sania Mirza (Tennis) Manika Batra (Table Tennis) JaRA Table Tennis especially if we look at Olympics. What's your thoughts?""","""Ye football toh promote kr ni parhe jabki itne log football khelne wale hai desh me tennis toh fir bhi ameero ka game h""",related
533,"""What is your most strongly held political opinion?""","""Companies shouldnt be allowed to fund political matters.""",direct
534,"""Tea on soccer (football) players or teams? Anything really! Like joao felux, jude bellingham, riccardo calafiori etc""","""idk if you’d consider it tea, but i have family who work in fashion/athleisure and most of them have said the majority of footballers are quite nice of course you could argue that it’s PR training but lots of famous people are PR trained and are still pricks behind the scenes""",direct
535,"""What saddens you about the political environment in 2026?""","""It's become extremely black and white.

""You're either with us, or you're x,y,z."".

What happened to ""agree to disagree"" or finding common ground?""",direct
536,"""How popular is Table Tennis in China? How popular is Table Tennis in China? China is by Far the best nation in Table Tennis, they absolutely dominate the sport, but How popular is the sport in People? How famous someone like Ma Long or Fan Zhendong is in China?""","""TT in China is as popular as NFL in the US.""",direct
537,"""Why does sports betting seem like it's something you could easily profit on but you really can't?""","""Check your bets with betcheckup dot com""",related
538,"""How drastically has your political views changed within the last 10 years or so and why?""","""150 degrees. I now realize how truly dangerous the far right is in the United States.

They are willing to vote a pedophile in if it serves their purpose.""",direct
539,"""How would Republicans react to the last year if Trump was a Democrat?""","""See Jan 6th 2021 for details.""",off-topic
540,"""What sport do you play?""","""Tennis, track and field, cross country and I used to be division champion for my area in soccer""",direct
541,"""What non-political opinion gives away someone's politics?""","""What ever anyone posts here could be a pretty strong indicator of who they disagree with""",related
542,"""Is league still worth getting into for a new player?""","""Yes""",direct
543,"""What's stopping the federal government from injecting a huge amount of money into the public school system?""","""According to this source, the total spending on K-12 education in the U.S. is around $600 billion:

https://worldpopulationreview.com/state-rankings/per-pupil-spending-by-state

In addition, the U.S. federal department of education budget is around $250 billion.

The total U.S. budget is around $7 trillion, so I don't think it's true that you could inject a huge amount of money into the public school system while being an ""insignificant"" amount of the federal budget. Increasing it by just 15% would be more than the entire federal SNAP program.

I'm not trying to disagree that it would be a good thing to invest more in public schools. I'd love to see that. The current Trump administration has the opposite priority, they are trying to get rid of the Dept of Education altogether.""",direct
544,"""Does this generation watch Harry Potter?""","""There are a lot questionable things in the books""",related
545,"""What do you guys think about Jimmy Fallon?""","""He means well. Had some memorable moments on SNL then a very solid run on Late Night. I personally think he’s been in his own head ever since he got the tonight show and overexposure has lead to people hating him.""",direct
546,"""Is Hockey the national sports of India? Is Hockey the national sports of India? In school books, it's written that Hockey is the national sports of India. What's your opinion?""","""There is no official National sport in India as of now.""",related
547,"""What did Newt Gingrich do to the Republican Party?""","""He taught Republicans how to poisin minds with language.""",direct
548,"""Just been thinking about this lately... been coding for like 3 yrs now and realized some tiny habits I picked up have made my code wayyy better.

For me it was finally learning how to use git properly lol (not just git add . commit ""stuff"" push 😅) and actually writing tests before fixing bugs instead of after.

What little thing do you do thats had a huge impact? Doesn't have to be anything fancy, just those ""oh crap why didnt i do this earlier"" moments.""","""Never go into a battle without a plan.""",off-topic
549,"""Did Canada cheat during the curling game against Sweden?""","""No but every Olympic Sub thinks so even after getting disproven. I've muted every single one at this point. Sweden was mad they lost, cried to the officials who then reviewed it said nothing was wrong then the Federation came out and explained Rules 5 and 9 because no one clearly read the 71 pages (which is like what a couple hours of reading maybe 3 depending on your pace?).""",direct
550,"""Thoughts on the state of Fortnite?""","""Just say you suck at the game and hate capitalism""",related
551,"""Did Canada cheat during the curling game against Sweden?""","""I have never watched curling, but I have seen a bunch of people explaining the rules and saying the touch is allowed 😕 I think it's funny that these two countries are fighting like that. Stereotypically, Canada is known for being very polite, and Sweden is known for being very shy or introverted.""",direct
552,"""Most Overrated Restaurant in Hamilton? Give me your hot takes. What’s a popular place in Hamilton that you just don’t understand the hype around.""","""Saltlick Smokehouse for me. Its a shame because I find the staff there really nice and the vibe is cool but I thought the food was pretty bland. Its pretty expensive yet I found a lot of the food there very dry for BBQ, especially the brisket.""",direct
553,"""What is the definition of Trump derangement symptom?""","""This is an interesting question... but behave. We will be watching closely for moderation.""",off-topic
554,"""Is anime more mainstream than western cartoons?""","""Depends of where you live tbh. In Asia anime is way more dominant than western animation (aside from maybe the occasional Disney or dreamworks movie). There’s way more demon slayer merchandise in Thailand than there is Rick and Morty.""",direct
555,"""How can anybody still support Trump?""","""I don't understand them. Seriously. Sick people thinking it's all ok, or as one of my aunts (who I no longer speak to) claims is all fake news. Unbelievable!

Living in Mexico, I still see the gringo Trumpers here. When they try to argue how the USA has benefited Mexico, I ask them for an example... ""oh! We are tourists and without tourism, Mexico wouldn't exist!"" That comeback is so lame.""",direct
556,"""What has US politics taught you so far ?""","""Billionaires are fucking stupid""",direct
557,"""Is among us good?""","""It looks really fun to play with friends but I have non sooooooooooooooo""",direct
558,"""What is the best movie you watched in 2025 and why did it stay with you?""","""I turned on Sorcerer (1977) based on the name and the poster alone and was absolutely locked in from beginning to end.""",direct
559,"""How can anybody still support Trump?""","""Most likely because they feel they are still allegations, for example, if some documents stated that you committed xyz crime, then you would still have to be tried in court and be found actually guilty of these allegations. Basic stuff op.""",direct
560,"""Donald Trump just said “we shouldn’t even have an election”. Americans, what are your thoughts?""","""“Those who make peaceful revolution impossible will make violent revolution inevitable.”

Time and time again history has taught us what happens.

Now would be a good time to stock up on emergency food and goods if you are able.""",direct
561,"""Hi everyone,

I’m really new to both programming and GitHub. I recently created an account hoping to learn how to collaborate on projects and track my code like developers do, but to be honest... I still don’t understand anything about how GitHub works or how I’m supposed to use it.

Everything feels overwhelming — branches, commits, repositories, pull requests… I’m not even sure where to click or what to do first.

Can anyone recommend super beginner-friendly tutorials, videos, or guides that helped you when you were just starting out? I’d really appreciate any step-by-step resources or even personal advice.

Thanks in advance for your kindness and support!""","""Id start with actually using GitHub, make a repo, clone a repo, make a fork. Learn the concepts with the GUI of what it all is and looks like visually. Then, try to recreate what you do with git commands.

Can you: - make a repo - clone a repo - form a repo - make a commit - push and pull, sync, your commits - etc

Visual studio code is free and has a nice gui + git commands interface that could help you jump between the two.

The best way to learn in my experience is figure out what you want to do, ask and search around how to do that thing, and then how to do it specifically (or here, the git command to do it).""",direct
